{
  "Format": {
    "definitions": [
      {
        "key": "EXERGY",
        "width": 10,
        "precision": 1,
        "unit": "(kW)"
      },
      {
        "key": "EXERGY_COST",
        "width": 10,
        "precision": 1,
        "unit": "(kW)"
      },
      {
        "key": "EXERGY_UNIT_COST",
        "width": 10,
        "precision": 4,
        "unit": "(J/J)"
      },
      {
        "key": "GENERALIZED_COST",
        "width": 10,
        "precision": 2,
        "unit": "(c/h)"
      },
      {
        "key": "GENERALIZED_UNIT_COST",
        "width": 10,
        "precision": 4,
        "unit": "(c/kWh)"
      },
      {
        "key": "DIAGNOSIS",
        "width": 10,
        "precision": 2,
        "unit": "(kW)"
      }
    ]
  },
  "ProductiveStructure": {
    "flows": [
      {
        "key": "B1",
        "type": "RESOURCE"
      },
      {
        "key": "B2",
        "type": "RESOURCE"
      },
      {
        "key": "B3",
        "type": "INTERNAL"
      },
      {
        "key": "B4",
        "type": "INTERNAL"
      },
      {
        "key": "B5",
        "type": "INTERNAL"
      },
      {
        "key": "B6",
        "type": "INTERNAL"
      },
      {
        "key": "B7",
        "type": "INTERNAL"
      },
      {
        "key": "B9",
        "type": "INTERNAL"
      },
      {
        "key": "B10",
        "type": "INTERNAL"
      },
      {
        "key": "B11",
        "type": "INTERNAL"
      },
      {
        "key": "B12",
        "type": "INTERNAL"
      },
      {
        "key": "WGC",
        "type": "INTERNAL"
      },
      {
        "key": "WAC",
        "type": "INTERNAL"
      },
      {
        "key": "WN",
        "type": "OUTPUT"
      },
      {
        "key": "QG",
        "type": "WASTE"
      }
    ],
    "processes": [
      {
        "key": "CC",
        "type": "PRODUCTIVE",
        "fuel": "B5+B6",
        "product": "B7"
      },
      {
        "key": "GC",
        "type": "PRODUCTIVE",
        "fuel": "WGC",
        "product": "B4-B2"
      },
      {
        "key": "AC",
        "type": "PRODUCTIVE",
        "fuel": "WAC",
        "product": "B3-B1"
      },
      {
        "key": "GHE",
        "type": "PRODUCTIVE",
        "fuel": "B10-B12",
        "product": "B6-B4"
      },
      {
        "key": "AHE",
        "type": "PRODUCTIVE",
        "fuel": "B9-B11",
        "product": "B5-B3"
      },
      {
        "key": "TRB",
        "type": "PRODUCTIVE",
        "fuel": "B7-B9-B10",
        "product": "WN+WGC+WAC"
      },
      {
        "key": "STCK",
        "type": "DISSIPATIVE",
        "fuel": "B11+B12",
        "product": "QG"
      }
    ]
  },
  "ExergyStates": {
    "States": [{
      "stateId": "Reference",
      "exergy": [
        {
          "key": "B1",
          "value": 0
        },
        {
          "key": "B2",
          "value": 12077.294685990339
        },
        {
          "key": "B3",
          "value": 4995.1690821256043
        },
        {
          "key": "B4",
          "value": 12643.719806763285
        },
        {
          "key": "B5",
          "value": 8113.5265700483105
        },
        {
          "key": "B6",
          "value": 13004.830917874397
        },
        {
          "key": "B7",
          "value": 16925.120772946859
        },
        {
          "key": "B9",
          "value": 6246.376811594203
        },
        {
          "key": "B10",
          "value": 727.05314009661834
        },
        {
          "key": "B11",
          "value": 2387.68115942029
        },
        {
          "key": "B12",
          "value": 277.77777777777777
        },
        {
          "key": "WGC",
          "value": 650.96618357487921
        },
        {
          "key": "WAC",
          "value": 5602.6570048309177
        },
        {
          "key": "WN",
          "value": 3000
        },
        {
          "key": "QG",
          "value": 2665.4589371980678
        }
    ]}
    ]
  },
  "WasteDefinition": {
    "wastes": [{
      "flow": "QG",
      "type": "MANUAL",
      "recycle": 0.6,
      "values": [{
        "process": "CC",
        "value": 1
      }
    ]
  }]
  }
}